{
  "canonical_repository": "Jktomy/atlas-prime",
  "entries": [
    {
      "completion_basis": "Prime Reborn cutover source merged after final whole-program Strikeforce GREEN",
      "next_gate": "CLOSED",
      "owner": "Atlas / Source Governance",
      "quest_id": "PRIME-REBORN-QUEST-R01",
      "source": "quests/prime-reborn.md",
      "state": "COMPLETE"
    },
    {
      "next_gate": "CLOSED",
      "owner": "Codex / Source Governance",
      "quest_id": "QUEST-REPAIRING-PRIME-R01",
      "source": "quests/repairing-prime.md",
      "state": "COMPLETE",
      "completion_basis": "RP-C01-RP-C08 are complete; AJ-01-AJ-12 are PROVEN; CAP-027 is RESTORED/ACTIVE; all 28 capability dispositions are reconciled with 0 BLOCKED and 0 STILL_MISSING. Phoenix recovery is accepted. Sunset PR #224 merged at 40e58dcf33bae68f8c819c2f65c6474f52381718. The generated publisher run 29536662886 proved Ubuntu/Windows parity and a truthful zero-delta NOOP. Living Emberline is COMPLETE/CLOSED; Repairing Prime is removed from active continuity; independent Quest states are unchanged."
    },
    {
      "completion_basis": "Mission #276 transferred Investiture Accounting to the bounded Codex / Operation Source Governance Mission family with FS-C01-M01 through M03 proven and M04 unfinished; Glass Codex to Prime Ascendant / Operation Glass Codex; and Seon to Prime Ascendant / Operation Harmony. Apple Reminders authority and the Hermes bridge boundary are unchanged. Historical source, receipts, checkpoints, identity decisions, recovery, and proof remain preserved.",
      "next_gate": "CLOSED",
      "owner": "Codex / Source Governance",
      "quest_id": "QUEST-FOUND-SILVERLIGHT-R01",
      "source": "quests/found-silverlight.md",
      "state": "COMPLETE"
    },
    {
      "next_gate": "PF-C01-M02 Preview — Preserve the Old Flame",
      "owner": "Odyssey / Prometheus Foundation",
      "quest_id": "QUEST-PROMETHEUS-FIRE-20260701",
      "source": "quests/prometheus-fire.md",
      "state": "IN_PROGRESS",
      "readiness_basis": "PF-C01-M01 remains accepted and PF-C01-M02 remains next. Missions #283 and #285 fix the public-clean Cloud Atlas topology plus Apollo/Hermes endpoint, isolation, source, reinstall, degraded-mode, and recovery proof requirements. Apollo/Hermes protected proof, native workflows, private route, Windows recovery, PF-C01-M02 exit, commissioning, migration, and runtime remain unproven."
    },
    {
      "next_gate": "NW-C01 readiness package and Jayson-side proof",
      "owner": "Odyssey / Citadel-Gatehouse Infrastructure",
      "quest_id": "QUEST-NOTUMS-WATCH-20260708",
      "source": "quests/notums-watch.md",
      "state": "READY_FOR_JAYSON_EXECUTION_PACKAGE",
      "readiness_basis": "Notum's Watch and Sentinel durably own independent monitoring. Mission #284 defines only minimized read-only Glass Codex presentation with explicit freshness and denied control. Protected placement and execution remain Jayson-side; no telemetry connection, monitoring activation, or NW-C01 advancement is claimed."
    },
    {
      "completion_basis": "Mission #277 preserved the accepted AJ-08 schema-driven admission evidence, confirmed that validator and continuity-engine bytes were unchanged during admission, found no remaining independent Quest-scale objective, and closed the proof Quest without promoting any capability or changing runtime, provider, protected-data, READY, or merge authority.",
      "next_gate": "CLOSED",
      "owner": "Codex / Source Governance",
      "quest_id": "QUEST-PRIME-CONTINUITY-PROOF-R01",
      "source": "quests/prime-continuity-proof.md",
      "state": "COMPLETE"
    },
    {
      "next_gate": "PA-C01 — Write the Covenant",
      "owner": "Artemis / Operation Harmony",
      "quest_id": "QUEST-PRIME-ASCENDANT-20260717",
      "source": "quests/prime-ascendant.md",
      "state": "IN_PROGRESS",
      "readiness_basis": "Missions #279 and #282 establish Cloud Atlas protected-realm and Glass Codex client boundaries. Glass Codex is client-independent with a first-party VS Code direction, stable API lanes, denied authority, retention cleanup, packaging, and GUI-failure independence. PA-C01 remains current; no implementation, Apollo install, runtime, recovery proof, or later Campaign gate advances."
    }
  ],
  "format_version": "1.0",
  "generated": false,
  "predecessor_workboard_route": "HISTORICAL_ONLY",
  "state": "CANONICAL_ACTIVE"
}
